{
  "$schema": "./site-facts.schema.json",
  "siteUrl": "https://yourfamilyfirstinsurance3.com",
  "businessName": "Your Family First Insurance Office #3",
  "brandName": "Your Family First Insurance",
  "officeHours": "Monday–Friday 9 a.m.–6 p.m.; Saturday 9 a.m.–3 p.m.; Sunday closed.",
  "openingHoursSpecification": [
    { "@type": "OpeningHoursSpecification", "dayOfWeek": ["Monday", "Tuesday", "Wednesday", "Thursday", "Friday"], "opens": "09:00", "closes": "18:00" },
    { "@type": "OpeningHoursSpecification", "dayOfWeek": "Saturday", "opens": "09:00", "closes": "15:00" },
    { "@type": "OpeningHoursSpecification", "dayOfWeek": "Sunday", "opens": "00:00", "closes": "00:00" }
  ],
  "agencyLicense": {
    "number": "L134140",
    "legalName": "APLUSATTITUDE INSURANCE LLC DBA YOUR FAMILY FIRST",
    "verificationUrl": "https://licenseesearch.fldfs.com/Licensee/2757386"
  },
  "phone": {
    "display": "305-910-8850",
    "tel": "tel:13059108850",
    "sms": "sms:+13059108850"
  },
  "address": {
    "streetAddress": "11200 W Flagler St, Suite 108-109",
    "addressLocality": "Miami",
    "addressRegion": "FL",
    "postalCode": "33174",
    "addressCountry": "US"
  },
  "quoteDestination": "https://secure.ConsumerRateQuotes.com/ConsumerV2?id=64868",
  "serviceAreas": [
    "Miami",
    "Sweetwater",
    "Doral",
    "Hialeah",
    "Kendall",
    "Florida"
  ],
  "insuranceTypes": [
    "Auto insurance",
    "Homeowners insurance",
    "Renters insurance",
    "Flood insurance",
    "Motorcycle insurance",
    "Boat insurance",
    "RV insurance",
    "Commercial insurance",
    "Business insurance",
    "General liability insurance",
    "Workers' compensation insurance",
    "Life insurance",
    "Health insurance"
  ],
  "approvedAssetPaths": {
    "officialLogo": "/assets/yffi3/yffi3-official-franchise-logo.png",
    "originalLogo": "/assets/yffi3/yffi3-original-franchise-logo.png",
    "familyPhoto": "/assets/yffi3/yffi3-family-office-photo.jpg",
    "familyPhotoWebp": "/assets/yffi3/yffi3-family-office-photo.webp",
    "principalPhoto": "/assets/yffi3/yffi3-principal-agent-ariel-busutil.jpg",
    "quoteQr": "/assets/yffi3/yffi3-quote-qr.jpeg"
  },
  "contentBoundaries": {
    "prohibitedClaims": [
      "guaranteed cheapest",
      "guaranteed savings",
      "instant approval",
      "guaranteed approval",
      "official partner",
      "authorized carrier partner",
      "award-winning",
      "top-rated"
    ],
    "disclaimer": "Coverage, pricing, discounts, eligibility, and availability vary by carrier, underwriting, location, and applicant information."
  }
}
